{
  "metadata": {
    "project_id": "Project_001",
    "agent": "layout",
    "task_id": "task-7f3a",
    "timestamp": "2026-07-22T10:00:00+08:00",
    "schema_version": "1.0",
    "status": "COMPLETED",
    "quality": { "confidence": 0.95, "quality_score": 92, "validation_passed": true }
  },
  "version": {
    "model_version": "v1",
    "parent_version": "none",
    "change_reason": "initial layout of 100sqm three-room apartment",
    "changed_by": "layout_agent",
    "approval_status": "APPROVED",
    "timestamp": "2026-07-22T10:00:00+08:00"
  },
  "rooms": [
    { "room_id": "R001", "name": "客厅", "type": "LIVING", "boundary": [[0, 0], [6000, 0], [6000, 4000], [0, 4000]], "area": 24.0 },
    { "room_id": "R002", "name": "主卧", "type": "MASTER_BEDROOM", "boundary": [[6000, 0], [10000, 0], [10000, 4000], [6000, 4000]], "area": 16.0 },
    { "room_id": "R003", "name": "次卧", "type": "SECOND_BEDROOM", "boundary": [[0, 4000], [4000, 4000], [4000, 7000], [0, 7000]], "area": 12.0 },
    { "room_id": "R004", "name": "厨房", "type": "KITCHEN", "boundary": [[4000, 4000], [6000, 4000], [6000, 7000], [4000, 7000]], "area": 12.0 },
    { "room_id": "R005", "name": "卫生间", "type": "BATHROOM", "boundary": [[6000, 4000], [10000, 4000], [10000, 7000], [6000, 7000]], "area": 16.0 }
  ],
  "furniture": [
    { "id": "F001", "category": "SOFA", "position": [1500, 2000], "rotation": 0, "size": { "width": 2400, "depth": 900, "height": 850 } },
    { "id": "F002", "category": "BED", "position": [7000, 2000], "rotation": 0, "size": { "width": 1800, "depth": 2000, "height": 500 } }
  ],
  "constraints": [
    { "fixed_wall": "W-ext-south", "forbidden_area": [[9500, 4000], [10000, 4000], [10000, 7000], [9500, 7000]], "requirement": "卫生间靠外墙预留管道井，禁止改动" }
  ],
  "walls": [
    { "id": "W001", "start": [0, 0], "end": [10000, 0], "thickness": 200, "type": "BEARING" },
    { "id": "W002", "start": [0, 0], "end": [0, 7000], "thickness": 200, "type": "BEARING" },
    { "id": "W003", "start": [10000, 0], "end": [10000, 7000], "thickness": 200, "type": "BEARING" },
    { "id": "W004", "start": [0, 7000], "end": [10000, 7000], "thickness": 200, "type": "BEARING" },
    { "id": "W005", "start": [6000, 0], "end": [6000, 4000], "thickness": 120, "type": "PARTITION" }
  ],
  "doors": [
    { "id": "D001", "position": [3000, 0], "width": 900, "swing": "IN" },
    { "id": "D002", "position": [8000, 0], "width": 900, "swing": "IN" }
  ],
  "windows": [
    { "id": "WIN001", "position": [6000, 0], "width": 1800, "sill_height": 900 },
    { "id": "WIN002", "position": [0, 3500], "width": 1500, "sill_height": 900 }
  ]
}
